{
  "schema_version": "0.2.0",
  "created_at": "2026-08-18T00:00:00+00:00",
  "source_audio": "input/synthetic_interview.wav",
  "audio": {
    "duration": 20.0
  },
  "conversation_structure": {
    "version": "V2",
    "method": "deterministic_local_heuristics",
    "speaker_diarization_is_weak_evidence": true,
    "valid_roles": ["candidate", "interviewer", "unknown"],
    "valid_phases": [
      "BEHAVIORAL",
      "CANDIDATE_QUESTIONS",
      "CODING",
      "CODING_DISCUSSION",
      "END",
      "INTRO",
      "PROJECT",
      "TECH_QA",
      "UNKNOWN"
    ]
  },
  "speakers": [
    {
      "id": "speaker_0",
      "dominant_role": "interviewer",
      "role_confidence": 0.82,
      "role_counts": {
        "interviewer": 2
      }
    },
    {
      "id": "speaker_1",
      "dominant_role": "candidate",
      "role_confidence": 0.84,
      "role_counts": {
        "candidate": 2
      }
    }
  ],
  "segments": [
    {
      "id": "seg_0001",
      "start": 0.5,
      "end": 3.0,
      "speaker": "speaker_0",
      "speaker_id": "speaker_0",
      "role": "interviewer",
      "role_confidence": 0.91,
      "phase": "TECH_QA",
      "text": "请介绍一下你设计的缓存方案？",
      "cleanup": {
        "valid": true,
        "reasons": [],
        "duration_seconds": 2.5,
        "meaningful_char_count": 13,
        "text_density": 5.2,
        "question_strength": 5.0
      }
    },
    {
      "id": "seg_0002",
      "start": 3.2,
      "end": 10.0,
      "speaker": "speaker_1",
      "speaker_id": "speaker_1",
      "role": "candidate",
      "role_confidence": 0.9,
      "phase": "TECH_QA",
      "text": "我使用缓存保存高频查询结果，并通过版本号处理失效。",
      "cleanup": {
        "valid": true,
        "reasons": [],
        "duration_seconds": 6.8,
        "meaningful_char_count": 23,
        "text_density": 3.382,
        "question_strength": 0.0
      }
    },
    {
      "id": "seg_0003",
      "start": 10.2,
      "end": 11.5,
      "speaker": "speaker_0",
      "speaker_id": "speaker_0",
      "role": "interviewer",
      "role_confidence": 0.93,
      "phase": "TECH_QA",
      "text": "为什么？",
      "cleanup": {
        "valid": true,
        "reasons": [],
        "duration_seconds": 1.3,
        "meaningful_char_count": 3,
        "text_density": 2.308,
        "question_strength": 4.5
      }
    },
    {
      "id": "seg_0004",
      "start": 11.7,
      "end": 17.0,
      "speaker": "speaker_1",
      "speaker_id": "speaker_1",
      "role": "candidate",
      "role_confidence": 0.88,
      "phase": "TECH_QA",
      "text": "因为读流量明显高于写流量，并且结果允许短时间延迟。",
      "cleanup": {
        "valid": true,
        "reasons": [],
        "duration_seconds": 5.3,
        "meaningful_char_count": 24,
        "text_density": 4.528,
        "question_strength": 0.0
      }
    }
  ],
  "phase_spans": [
    {
      "phase": "TECH_QA",
      "start": 0.5,
      "end": 17.0,
      "segment_ids": ["seg_0001", "seg_0002", "seg_0003", "seg_0004"]
    }
  ],
  "events": [],
  "turns": [],
  "question_tree": [
    {
      "id": "Q1",
      "node_type": "main_question",
      "relation_to_previous": "first_question",
      "asked_by": "interviewer",
      "role_confidence": 0.91,
      "phase": "TECH_QA",
      "start": 0.5,
      "end": 3.0,
      "speaker_ids": ["speaker_0"],
      "segment_ids": ["seg_0001"],
      "text": "请介绍一下你设计的缓存方案？",
      "topic": {
        "label": "数据库与缓存",
        "keywords": ["缓存"]
      },
      "answers": [
        {
          "role": "candidate",
          "role_confidence": 0.9,
          "start": 3.2,
          "end": 10.0,
          "speaker_ids": ["speaker_1"],
          "segment_ids": ["seg_0002"],
          "text": "我使用缓存保存高频查询结果，并通过版本号处理失效。"
        }
      ],
      "children": [
        {
          "id": "Q1.1",
          "node_type": "follow_up",
          "relation_to_previous": "same_topic",
          "asked_by": "interviewer",
          "role_confidence": 0.93,
          "phase": "TECH_QA",
          "start": 10.2,
          "end": 11.5,
          "speaker_ids": ["speaker_0"],
          "segment_ids": ["seg_0003"],
          "text": "为什么？",
          "topic": {
            "label": "未分类",
            "keywords": []
          },
          "answers": [
            {
              "role": "candidate",
              "role_confidence": 0.88,
              "start": 11.7,
              "end": 17.0,
              "speaker_ids": ["speaker_1"],
              "segment_ids": ["seg_0004"],
              "text": "因为读流量明显高于写流量，并且结果允许短时间延迟。"
            }
          ],
          "children": []
        }
      ]
    }
  ],
  "qa_pairs": [
    {
      "id": "qa_v2_001",
      "root_question_id": "Q1",
      "segment_ids": ["seg_0001", "seg_0002", "seg_0003", "seg_0004"]
    }
  ],
  "statistics": {
    "raw_segment_count": 4,
    "valid_segment_count": 4,
    "invalid_segment_count": 0,
    "v1_qa_count": 1,
    "qa_count": 1,
    "question_count": 2,
    "main_question_count": 1,
    "follow_up_count": 1,
    "clarification_count": 0,
    "topic_switch_count": 0,
    "coding_silence_event_count": 0,
    "coding_event_count": 0,
    "unknown_role_count": 0,
    "valid_unknown_role_count": 0,
    "role_correction_count": 0,
    "cleanup_reason_counts": {}
  }
}
